59,Molestias quo hic qui.,"Consequatur dolorum eveniet porro et blanditiis ut. Repellendus eveniet natus nobis excepturi quisquam qui sunt. Sunt perspiciatis voluptates nihil tenetur. Nobis in voluptatem aut sunt. Occaecati adipisci sed eos. Et iste enim delectus pariatur aut reprehenderit quia. Odio et non quas sit. Eveniet autem magni rerum. Nostrum aperiam eos rem laborum. Dolorum excepturi ut in blanditiis rem. Exercitationem iure placeat temporibus labore minus. Enim id repellat ea quam velit. Impedit ut deserunt dignissimos facere saepe expedita et. Laborum qui distinctio. Et qui quia suscipit ab accusantium explicabo animi. Voluptates nihil quia. Velit unde magnam eligendi sint earum sunt. Aut nobis inventore nesciunt aperiam sed. Impedit molestiae recusandae suscipit illum. Vero quaerat et ut qui.",154,2017-06-02 22:22:12,2020-04-13 15:51:58,"CHEST"
60,Repellendus qui laudantium sapiente id modi excepturi.,"Repellat doloremque voluptas. In omnis vel. Et nulla quaerat et exercitationem quia quasi omnis. Aspernatur est aut fuga. Aliquid voluptas vel. Accusamus perferendis sequi voluptatum. Distinctio recusandae eum voluptates tempora. Cupiditate beatae aut perferendis quia. Possimus harum quasi sint aliquam tenetur. Corrupti repellat corporis itaque libero. Voluptatum qui sint et cupiditate dolor facilis. Non quod illum voluptatum est aperiam iure voluptatibus. Non aut qui necessitatibus eos nihil nulla. Porro sapiente magni. Et itaque voluptates et voluptas. Totam nihil ipsum fugiat quos. Est quasi necessitatibus est quae nihil id consequuntur. Maiores adipisci omnis dolorum. Adipisci sunt exercitationem qui. Doloremque eum voluptatem cupiditate mollitia minus. Ratione ut ea voluptatem aut quia. Praesentium quo omnis sed quia asperiores dolores. Omnis odit perferendis.",74,2020-01-04 23:20:59,2020-04-13 15:51:58,"EYES<>SKIN<>HEART"
61,Enim molestiae est sit assumenda sequi.,"Autem omnis quis amet perspiciatis similique. Est aut non quae ut quas. Illum occaecati quibusdam dolore pariatur aut quas. Ab facere molestiae explicabo. Adipisci aliquid consequatur. Quaerat recusandae rerum ut ex. Quia quia doloremque et nemo tenetur. Ipsam saepe molestias qui optio eveniet. Quia quibusdam qui deserunt temporibus. Quas beatae consequatur. Reprehenderit deserunt officiis recusandae. Cupiditate repellendus quam est quis. Cupiditate accusantium itaque dolores voluptatem et libero. Dignissimos nesciunt commodi dolorem. Eos sed modi quae aut iste. Quibusdam odio fuga quibusdam a omnis occaecati. Enim reiciendis voluptates nihil voluptatem. Debitis sint laudantium velit exercitationem dolorem. Architecto repellendus cum. Id qui expedita laudantium atque. Quis non ut architecto velit quo eveniet. Ad architecto harum rerum. Consequatur doloremque omnis sit cupiditate sunt.",107,2018-02-01 12:20:18,2020-04-13 15:51:58,"EYES<>DENTAL"
62,Suscipit fugiat unde facilis doloremque.,"A corrupti exercitationem voluptatem id qui rerum est. A distinctio fugiat omnis hic aperiam cumque. Dolorem porro distinctio a assumenda minima deleniti. Eveniet repellendus est laudantium. Ratione commodi eaque quia vel nemo. Cum quo est eos illo inventore sed. Hic est modi cum dolorem. Quaerat est a autem nihil explicabo. Vero amet quos velit praesentium omnis qui aliquid. Qui doloribus soluta dolores. Dolorem et eligendi ea. Voluptatem repudiandae eaque nulla recusandae atque vitae. Autem totam voluptatem minima nulla praesentium nobis. Itaque eius natus non ut qui impedit est. Doloremque delectus eum voluptatem reiciendis aperiam. Ut non tempore autem animi. Amet adipisci illo tempora repellat fugiat. Similique quam laboriosam aut quisquam cupiditate. Sit illo voluptatibus. Illum deserunt voluptatibus tenetur impedit voluptatum. Officia ut sequi. Ducimus consectetur sed. Nemo qui modi assumenda sunt.",154,2018-08-22 23:21:18,2020-04-13 15:51:58,"CHEST<>HEART"
63,Optio perspiciatis est vel.,"Totam iusto doloribus aut molestiae. Dicta pariatur enim id sunt eos. Laboriosam impedit quia debitis. Rem quidem exercitationem. Rerum architecto delectus saepe commodi doloribus quo alias. Pariatur tenetur delectus. Non blanditiis tenetur. Quod quas asperiores rerum neque. Iure eum velit consequatur omnis. Consequatur veniam voluptas. Sed maiores commodi. Vitae eos vitae saepe. Officiis voluptatem cum dolorem sint. Totam distinctio laboriosam perspiciatis natus. Necessitatibus expedita assumenda reprehenderit magni ut non rerum. Sapiente officia natus qui. Earum possimus consectetur. Magni animi qui ducimus est. Mollitia corrupti quia qui earum consequatur delectus magni. Error quod maiores voluptatem. Inventore consequatur animi aliquam quas. Qui ut ut et et nobis.",155,2019-03-16 21:22:23,2020-04-13 15:51:58,"EAR_NOSE_THROAT<>EYES<>SKIN<>HEART"
64,Ut cupiditate quo eum dolor consequuntur quaerat et.,"Dolores consequatur quia debitis sunt. Nihil vel voluptas voluptas nemo non. Eos aut accusamus quia. Est explicabo sit ad iure officia. Ut aut qui maxime et. Provident voluptate dolores nostrum impedit est. Qui fuga voluptatem numquam corporis aut laboriosam. Enim iusto itaque voluptatem ea incidunt quis accusantium. Odit numquam neque. Saepe perspiciatis dolor odit officiis est architecto ipsa. Architecto atque vel provident error ut. Quam temporibus omnis dolorum nesciunt mollitia. Iusto dolorem eum et. Corporis non non labore commodi dolorem maxime. Omnis consequuntur ut. Omnis sint perspiciatis et. Doloremque nesciunt harum. In voluptatibus distinctio natus velit ut. Rerum magni ipsum qui quia error eaque ut. Qui dolorem aut architecto. Fugit ab temporibus iusto quis molestiae fugiat distinctio. Culpa et ipsa illo nesciunt. Numquam unde inventore sed blanditiis omnis libero.",29,2017-03-23 06:29:10,2020-04-13 15:51:58,"EYES<>CHEST<>SKIN<>HEART"
65,Rerum provident quaerat enim vel.,"Nihil tempore amet corporis fuga. Dolores ab qui quos voluptas harum. Suscipit quo reiciendis eius enim et. Eveniet libero ullam non. Dolor aut iste est culpa ullam et consequatur. Nisi velit dolores beatae. Repudiandae dolore dicta iure quo cupiditate nihil. Dicta perspiciatis delectus. Incidunt quisquam nulla eveniet et sint eaque occaecati. Tempora consequatur atque molestiae dolore accusantium ut. Ut corrupti est iusto veritatis et magnam. Accusantium dicta repellendus natus voluptatem aspernatur a. Sapiente enim dignissimos. Aut non labore nostrum dolor. Dolor iure est est sit et aspernatur vitae. Adipisci dicta aut. Delectus qui officia ad facilis dolore odit.",8,2018-04-08 19:56:42,2020-04-13 15:51:58,"HEART"
66,A sequi temporibus consequatur beatae.,"Qui id id veritatis. Voluptatem qui nam. Nam et velit accusamus sit quia quasi. Nulla ipsum aut itaque sit temporibus facere. Debitis corrupti qui accusantium ipsum iure repellendus cum. Delectus qui impedit harum facilis et beatae excepturi. Voluptatibus dignissimos tempore porro. Necessitatibus excepturi rem harum sequi quia. Et illum ut provident eum est consequatur. Debitis aut eum. Reprehenderit iusto magni non excepturi ad. Nobis dolor dolorem est nam aperiam atque minima. Officiis est voluptatibus necessitatibus. Nostrum laboriosam nostrum repudiandae. Ipsam eum totam. Officiis corporis occaecati esse repellendus pariatur ullam. Qui aut ipsa sunt. Deserunt facere adipisci eligendi quae. Quia consequatur vel et distinctio fugit magni. Eius ab dolores maiores sunt sed animi ad. Sit qui excepturi autem sint. Et ut molestiae eveniet dolores. Sapiente aspernatur laboriosam repudiandae sint deleniti beatae. Qui voluptas deserunt.",184,2016-12-04 06:31:06,2020-04-13 15:51:58,"EAR_NOSE_THROAT<>DENTAL"
67,Aut hic provident et earum.,"Aut nobis perspiciatis recusandae et adipisci quasi. Dolorum molestiae et blanditiis quis ipsa impedit et. Sunt porro eos. Facilis explicabo magnam voluptates modi. Et molestias dolore nesciunt. Velit dolore eum aspernatur. Tenetur voluptatum vel quibusdam et voluptatem. Totam inventore a modi libero necessitatibus sed et. Sequi totam temporibus et vero incidunt ut. Earum aperiam quo et. Quo itaque aperiam vel impedit velit eum ipsam. Voluptate quia est molestiae placeat rerum. Nihil odio quam quibusdam amet recusandae delectus dolorem. Et exercitationem labore dicta voluptatem. Repellat et nihil ut ipsam optio. Qui praesentium nobis et perspiciatis itaque. Ducimus quo qui error quod ut. Est neque dolor. Atque provident omnis inventore cumque nam earum. Sunt iusto cupiditate occaecati. Voluptatem sit qui in aut repellat.",29,2016-08-19 10:10:05,2020-04-13 15:51:58,"EYES"
68,Consequatur aspernatur possimus nesciunt sapiente recusandae illum.,"Cumque est placeat voluptatum. Aut enim totam. Saepe debitis voluptas quibusdam. Officia amet repellendus saepe nihil sequi aperiam quis. Odio totam unde. Omnis aliquid commodi autem. Assumenda at voluptatem laborum voluptatem veritatis voluptatem nesciunt. Omnis officiis eum nemo qui esse quod quia. Reprehenderit dolores quod neque esse. Fuga voluptas nulla explicabo tenetur alias. Autem quia ut dolorem deserunt. Ratione quae dolorem. Commodi amet reiciendis alias non accusamus. Ratione voluptatibus quo cupiditate. Culpa perferendis amet est alias dolore. Est labore consequuntur. Dolores porro hic praesentium architecto. Dolor nemo ea ad. Corporis maiores quis ea.",124,2020-03-21 03:49:18,2020-04-13 15:51:58,"DENTAL<>SKIN"
69,Blanditiis est quisquam.,"Dolore dolor tenetur exercitationem quo perferendis commodi. Aut natus aut quos. Qui animi quia vero. Et dolore cupiditate culpa similique tempore nam in. Molestias omnis quia magni quis optio sunt enim. Nam est error impedit sunt. Est aliquid repellat soluta aliquid non. Accusantium explicabo veniam voluptatem et. Nesciunt ut aliquid sed quisquam modi quia. Itaque laudantium voluptatem. Ipsa amet aliquam. Officiis nulla eaque velit. Saepe sint incidunt. Cumque impedit nam quo. Est quia aut. Quos dolor pariatur exercitationem. Odit corporis voluptatem aspernatur.",117,2019-12-21 06:24:05,2020-04-13 15:51:58,"EAR_NOSE_THROAT"
70,Deserunt aut enim pariatur pariatur in aut beatae.,"Aut dolore autem ut qui. Doloremque natus iusto culpa qui natus. Velit et voluptatem aut. Fugit rerum adipisci. Cupiditate iste minima in est. Et ut corporis qui modi ad eos saepe. Tenetur tempore ea molestias consectetur et et. Ducimus corporis id explicabo occaecati sit. Omnis eum qui quaerat natus. Velit atque maxime temporibus deleniti. Numquam inventore doloremque cupiditate. Adipisci a accusantium quo est pariatur ea. Quia illum qui et rerum itaque tempora. Eveniet ea esse vero velit accusamus. Est itaque fugit saepe et. Ullam aut incidunt est. Qui voluptatem labore necessitatibus et officia neque sint. Consequatur et vel animi ducimus consequatur.",189,2018-12-18 14:54:30,2020-04-13 15:51:58,"EYES<>CHEST<>SKIN<>HEART"
71,Quidem non rerum reiciendis ratione consequatur.,"Quis alias accusantium ut nobis. Praesentium quasi modi ut sint et pariatur consequatur. Dolorem consequatur tenetur hic. Ut unde sit dicta minima culpa ut id. Dicta reiciendis quae non aut quibusdam vitae dolore. Temporibus veniam necessitatibus laboriosam consequatur repellat dolorem sed. Nostrum voluptatibus consequatur. Sit et sed velit aut qui cumque. Unde alias est vero itaque doloribus. Et repudiandae excepturi iste. Numquam vero ipsum eos. Corporis commodi quidem eveniet quia. Voluptas maiores et sapiente. Repellendus expedita magnam eveniet rerum. Id dolores voluptates. Qui quidem impedit deleniti. Voluptates maiores harum rerum qui. Hic optio enim vel tempora. Quis magnam et.",56,2018-05-08 18:08:21,2020-04-13 15:51:58,"EAR_NOSE_THROAT"
72,Est qui quo odio ea cumque ut.,"Tempora sequi rerum possimus ut voluptas. Ipsam laudantium iste. Earum facilis perspiciatis aut minus quo enim facere. Nostrum omnis quia qui omnis quia. Dolorem doloremque consectetur illum at animi. Iusto quo quae. Harum nisi dolor. Inventore aut eos provident. Iusto et quia et excepturi sed autem optio. Sint aut accusantium nesciunt alias. Voluptas facilis fugit voluptates qui eaque minus modi. Et ipsa rem quia dolores. Qui illo ipsum est ipsam dolores neque ut. Consequatur nemo veritatis distinctio perspiciatis. Voluptates laboriosam sunt unde. Fugit molestiae neque dolore aut facere beatae. Vero quae molestias. Sit praesentium odio et minus. Ea vel consequuntur odio molestiae excepturi est voluptatem.",164,2019-10-08 18:46:06,2020-04-13 15:51:58,"EYES<>SKIN"
73,Voluptas dolorem laboriosam et officia et non.,"Ab excepturi cumque molestiae rem. Alias eos corporis placeat. Numquam magnam quam sunt. Nihil porro suscipit eos in quisquam quidem doloribus. Nulla provident ipsam id repellat eos ad. Aliquid ex quia possimus nihil ea neque. Praesentium qui hic. Est delectus explicabo sed possimus sint cumque. Vel sapiente quia. Incidunt sunt quae ipsa rerum et magnam. Officiis voluptatem recusandae voluptatem perspiciatis. Labore consequatur eius quia. Neque facere eaque ut deleniti iste quia ab. Vero et quis ab magnam sed est. Incidunt culpa tempora est vel voluptatem a perspiciatis. Incidunt labore corrupti ut. Facere aspernatur qui quidem. Dolor est et voluptate iusto amet. Voluptate eius quae neque vitae autem doloribus praesentium.",180,2016-12-11 22:21:52,2020-04-13 15:51:58,"EYES"
74,Et quam et dolorem sit quis velit aperiam.,"Mollitia recusandae iusto nostrum saepe veritatis natus. Minus eaque incidunt. Fuga maiores laboriosam dolor qui doloribus. Odit praesentium sapiente facere. Asperiores totam aut optio. Omnis consectetur aut officiis. Enim non laborum facilis eum et. Eius nulla rerum animi voluptatem quo neque expedita. Nesciunt aut et omnis minus veniam. A eos voluptas quibusdam deserunt minus repellendus numquam. Rem minima tempora quis excepturi nemo nisi est. Laboriosam quae aut non nesciunt suscipit ut dolores. Cupiditate libero mollitia eaque distinctio odit ut dolor. Consectetur qui ipsam similique. Et quibusdam unde fugit temporibus ipsam rem consequatur. Ipsam nobis vero ut aliquam ut. Perspiciatis voluptatum nesciunt quos alias iste sed sequi. Quisquam qui fugiat iusto totam. Ducimus et optio placeat earum. Eos libero in dolorem necessitatibus qui ut illo.",180,2017-02-05 13:52:06,2020-04-13 15:51:58,"CHEST"
75,Excepturi laboriosam sint ratione reprehenderit.,"Rerum magnam ad explicabo ut. Nobis corporis amet architecto molestiae vitae. Dolor et similique labore nobis. Autem earum veniam harum. Quam sed blanditiis ratione eos quia. Quod perspiciatis voluptatum nam totam. Voluptas consequuntur esse laboriosam aperiam modi in eaque. Qui ullam est et neque. Dolores nostrum nostrum et labore iure aut nam. Eligendi et sunt minima. Molestias quas cumque. Quia eaque fuga rem dolorum quos animi veniam. Cupiditate rerum dolor officia omnis. Consequatur officia aut eaque delectus facilis. Illo quis praesentium earum blanditiis voluptate quia itaque. Qui laudantium sint atque deserunt non. Vel ut tempore officia voluptas dolor quod. Aut iure ea omnis quia officia omnis est. Ea quisquam molestiae et voluptatum officiis et.",121,2018-02-19 16:07:29,2020-04-13 15:51:58,"EAR_NOSE_THROAT<>EYES<>DENTAL"
