1,Hic quas et facilis ut.,"Est qui velit cumque. Illum qui accusantium harum voluptates eos. Velit sit ratione sit libero qui. Commodi nam ipsum quia. Laborum aliquam et quo quam repellendus temporibus commodi. Est aut sit eum facere accusantium voluptas. Nihil odio maxime ea sint. Neque dicta omnis aut pariatur. Tempora alias rerum et veniam. Enim ducimus modi rerum dolore. Sint occaecati vitae ad. Non in repellat non debitis nostrum qui. Autem minus facilis nostrum blanditiis aut. Ex ipsa libero occaecati tempora necessitatibus. Est quas rerum aut laborum amet. Omnis expedita dolores similique consequatur recusandae provident. Fugit libero accusantium consectetur nulla et inventore magnam. Quo maxime distinctio dignissimos consequatur. Eum dolores veritatis sed.",185,2019-10-12 10:22:46,2020-04-13 15:51:58,"CHEST<>DENTAL<>SKIN"
2,Autem veritatis dolores non minima itaque eligendi sunt.,"Voluptas totam adipisci sed. Voluptas tenetur esse odit voluptatibus expedita. Et quia reprehenderit assumenda illo. Quasi nesciunt quo reprehenderit facere. Aut exercitationem impedit beatae qui omnis sit. Sint dolorem ullam aut repellendus veritatis officia dolores. Tempora id mollitia quo officia sunt. Culpa iure et suscipit omnis ipsa. Perferendis repellendus dolorum. Repellat est tenetur iusto. Aliquid eaque et. Dolorem quam aut. Earum voluptatem non nisi excepturi facere animi. Voluptas quisquam eum ipsa et similique laborum labore. Aut officiis explicabo deleniti provident consequatur occaecati sed. Tempore omnis optio repellat omnis. Nesciunt porro in ratione itaque delectus alias.",113,2020-01-10 12:28:19,2020-04-13 15:51:58,"HEART"
3,Labore ipsa harum non assumenda aut accusantium assumenda.,"Aut dolores eligendi. Officia possimus accusantium fugit. Ipsam eligendi eum esse unde nobis. Harum molestias in aut repudiandae reprehenderit. Illo enim numquam blanditiis. Voluptates dolor omnis. Provident consequatur odio nulla sunt ad. Esse enim ut ut eligendi. Et eveniet earum laborum in dolorem. Est suscipit repellendus odit tempore eaque qui. Rem iste doloremque nihil. Veniam iusto facere veritatis quibusdam minima. Fugit totam cupiditate. Amet possimus distinctio. Et ratione dolore autem est eaque. Aut culpa non incidunt possimus. Rem odio ea possimus. Et esse vero ex. Repellendus rerum neque sit eum. Rerum enim autem quae ipsum fugit. Consequatur vel tenetur minus.",12,2020-01-22 21:51:13,2020-04-13 15:51:58,"EAR_NOSE_THROAT<>SKIN<>HEART"
4,In rerum in autem et qui sit hic.,"Enim aut ullam sed eos et est. Itaque quasi vero. Ea perferendis ea qui. Eum similique dolore qui. Dolor voluptatum ut cum qui ipsam delectus sint. Aperiam magni incidunt fugit quia. At voluptatem quia facere. Quam omnis ex at ipsum asperiores recusandae reiciendis. Ipsa laudantium expedita dignissimos molestias optio doloribus voluptate. Minus et asperiores maxime qui. Explicabo eum sit rem temporibus quam maiores vel. Ipsa ea ut natus voluptas unde. Rerum vel et molestiae. Sed debitis dolorem. Id commodi velit dolor. Nihil possimus cum laboriosam. Non quia qui est nostrum impedit aut. Repudiandae officiis accusantium dignissimos et autem voluptas. Amet deserunt cum omnis et.",3,2018-11-13 06:55:51,2020-04-13 15:51:58,"DENTAL"
5,Ea et vel tempora ea culpa qui.,"Consectetur excepturi fugiat est atque eos exercitationem. Ratione consequatur labore ea et dicta quisquam et. Sit voluptate perspiciatis sint est aut. Ad perferendis ut nostrum doloremque consectetur. Quas eos est dolores. Ipsum exercitationem deserunt. Quidem illo consequatur occaecati hic et nemo cumque. Tempore ab est quam. Iure iusto fugit. Molestiae quod voluptatem dolore. Voluptatem possimus et deserunt consectetur. Voluptatem sunt numquam consequatur dolores accusantium consequatur. Debitis vero optio quis maxime nemo quis quos. Numquam sapiente qui et minima enim necessitatibus. Qui commodi unde. Repudiandae provident est est. Et optio totam quasi pariatur doloribus. Occaecati aliquid officia aliquam qui. Est eligendi id magnam nisi. Tempora itaque nobis aspernatur amet ea similique. Sit natus voluptatem adipisci rerum et consequuntur magni.",118,2018-07-26 14:59:55,2020-04-13 15:51:58,"EAR_NOSE_THROAT"
6,Iusto rem et.,"Numquam harum laudantium quis nulla eum modi quasi. Porro excepturi odit molestiae iusto dolores eligendi. Facere magnam sunt eveniet provident ratione ut. In quod eum aut eveniet et eum. Suscipit voluptatem non impedit cupiditate necessitatibus ut libero. Et eveniet nihil laborum laudantium expedita omnis. Minus dolores ex veritatis labore pariatur labore ut. Facere ad velit pariatur aut. Sint eligendi eligendi asperiores recusandae. Sit eum at dignissimos sapiente. Rerum et natus. Maxime atque repellendus sapiente sed temporibus nisi ad. Laudantium quaerat esse fugit illo consequatur reiciendis. Iusto perferendis aut eveniet est temporibus. Nesciunt distinctio sint tempora earum natus vero. Quis quo porro molestiae. Ratione sit quibusdam labore qui et sed quia. Nisi rerum et deleniti. Vero quasi rerum. Sequi ea expedita corrupti voluptatem sint voluptas. Et reprehenderit dolorum eaque nostrum omnis debitis.",189,2018-11-02 15:59:42,2020-04-13 15:51:58,"DENTAL"
7,Aspernatur animi harum rerum id.,"Dicta itaque quia. Voluptatum numquam est corporis sequi ut adipisci quos. Et omnis dolorem consectetur veniam dolores. Vel tempora illum ad atque ut consequatur saepe. Expedita rem qui. Dolore omnis autem nulla labore et quasi. Saepe tenetur velit consequatur. Quod et eligendi enim culpa impedit. Eum sit neque quaerat facilis dolorem eos consectetur. Libero explicabo consectetur aut earum doloremque ut. Voluptas recusandae dolorem itaque exercitationem. Unde eos qui eveniet ut consequatur quod. Cum sit aut. Sunt earum porro harum nisi. Repudiandae sit rerum. Et qui id et. Necessitatibus est officia tempora aliquid fugit illum quia. Voluptatem occaecati et.",30,2019-10-12 15:57:21,2020-04-13 15:51:58,"EYES<>SKIN"
8,Quod velit cupiditate non.,"Facilis qui est totam. Deserunt amet sit vitae deserunt aperiam deserunt reprehenderit. Veritatis molestiae ut qui. Dignissimos iusto sint magni rerum quo. Quaerat dolor est magni. Velit quam quidem in occaecati qui ipsa. Similique rem aliquid sit optio aut sed et. Modi omnis ea voluptates placeat omnis. Incidunt rerum vitae. Earum asperiores qui expedita. Corporis numquam iure. Dolore reprehenderit suscipit quasi recusandae. Quisquam ex commodi facilis nisi. Dolor rerum magnam similique possimus dolor et. Ut voluptatem ipsum inventore. Quae officia et ut earum voluptas soluta exercitationem. Assumenda aut repellat odio sed. Aut dolorem aut debitis aut. At rerum unde aut sit voluptatem deserunt. Voluptatem amet similique. Facilis dignissimos ut fuga molestias tempore perferendis. Explicabo ut odio est id adipisci mollitia.",118,2019-09-06 06:27:53,2020-04-13 15:51:58,"EAR_NOSE_THROAT<>EYES<>SKIN<>HEART"
9,Assumenda suscipit asperiores nisi accusantium.,"Saepe at et excepturi. Ut quam quod. Quaerat odio maxime aspernatur. Voluptatem aliquam consequuntur omnis autem. Autem eveniet nulla iure explicabo asperiores est maiores. Velit quibusdam in id. Aliquid amet natus a. Numquam corporis eaque repudiandae dolore consequatur modi. Architecto odit velit et id quo vel. Architecto voluptates perspiciatis sunt qui. Temporibus id animi ut ratione sed et sit. Quia iusto numquam. Labore molestiae omnis. Sapiente asperiores fugit ut occaecati. Placeat qui fugiat. Quas magnam ut voluptate voluptatem perspiciatis et. Vero rerum voluptas velit sit culpa. Nemo officiis ex ut rerum harum dolorem. Voluptatem doloribus hic nulla. Voluptatem rerum minus nemo maiores.",35,2019-06-21 20:51:31,2020-04-13 15:51:58,"EAR_NOSE_THROAT"
10,Fugiat rerum est voluptate est et.,"Facere temporibus ut et laboriosam consequatur magni. Natus quas eos magnam nam non quia quisquam. Ea et voluptas dignissimos fugiat id. Modi quam qui qui. Ex quia ipsam debitis temporibus tempora assumenda. Doloribus sed deserunt natus et aliquid similique qui. Id laborum assumenda perspiciatis tempore. Quis aut sunt vel. Dolores laudantium alias et. Perspiciatis tempore omnis quae commodi maxime in esse. Iste quisquam voluptate ut. Sit delectus deserunt rerum unde. Occaecati ullam consequatur. Amet harum consequatur expedita. Voluptates atque accusantium amet vel. Eveniet esse laboriosam ipsam. Eos in optio aut. Libero delectus optio. Optio incidunt labore et.",3,2017-04-11 01:01:45,2020-04-13 15:51:58,"HEART"
11,Et doloremque aut iusto.,"Consectetur dolorem eum qui. Consequatur minus dolore eveniet et omnis. Et aspernatur veniam laboriosam sint repellat sint. Officiis molestias nulla. Libero modi ex porro. Deleniti ut ea id ut autem porro. Fugiat animi omnis. Est et deleniti. Eius sed natus animi. Autem quae accusantium voluptas illo aspernatur. Voluptates magni nam. Eius in quibusdam autem aliquid. Molestiae expedita cupiditate consequatur quaerat fugiat. Omnis tenetur est vel. Deleniti illo et. Sunt ut corporis totam. Repudiandae aperiam error quaerat praesentium hic in est. Quia est dicta ut. Consectetur asperiores voluptatem autem qui. Temporibus nostrum quia eius tempora nemo explicabo. A ut soluta sunt numquam et ea. Impedit sit odio dolore aut. Alias quos ut. Culpa sed sed pariatur id. Consequatur doloribus facilis animi ullam ut facilis voluptatibus.",156,2019-07-21 21:00:48,2020-04-13 15:51:58,"EAR_NOSE_THROAT"
12,Ad veritatis dolor amet molestiae aut maxime sit.,"Voluptatem voluptates voluptatem quas id. Commodi at consequatur nihil. Deserunt sed dolorem nisi quis qui ad. Culpa in doloremque sint quia voluptas fugiat quasi. Enim aliquam aut commodi magni assumenda. Saepe rem itaque. Quis dolorum velit dolores enim ad. Similique architecto autem. Debitis et laudantium inventore quos omnis. Pariatur commodi consequatur hic repudiandae explicabo illo placeat. Consectetur fuga voluptatem a officiis numquam et. Aut vel dolore. Aut et rerum beatae molestiae quo sed. Qui nam laborum quia aut sequi sit. Deserunt in dolorem laborum in blanditiis possimus. Magni voluptas id rem nihil laudantium molestiae. Est nostrum esse sit. Quasi velit voluptatem qui at eligendi. Distinctio eum in. Doloribus qui ullam in nihil. Voluptatem voluptatem porro.",185,2018-09-13 18:12:18,2020-04-13 15:51:58,"CHEST"
13,Et eveniet totam fugit ipsum.,"Eligendi deleniti harum. Quam illo illo aut explicabo tempora. Laboriosam aspernatur alias omnis fugiat. Consequatur blanditiis eius fugit. Id autem soluta ipsam nulla ut eum molestias. Laborum sed enim aut iusto quis. Eaque doloremque ut illo maiores voluptatibus dolorum tenetur. Deserunt fugiat accusantium fugit in iure consequatur. Deserunt iusto sed. Quibusdam velit voluptatibus quo magnam a molestias sint. Quos ut eos eos et. Harum aut minima harum dolorem. Quo deleniti quo eveniet in. Ducimus officia architecto recusandae magnam expedita. Aut in at. Aut id sit enim dicta voluptatum aut impedit. Earum blanditiis quis magni. Laboriosam temporibus ex in. Iste aliquam perferendis eaque saepe commodi amet. Atque modi earum exercitationem distinctio nihil aut.",26,2020-02-15 19:29:22,2020-04-13 15:51:58,"EYES<>SKIN"
14,Ut est cumque rerum quam voluptatibus iure nobis.,"Laborum dolore aut sint incidunt. Mollitia sit nihil qui. Ut id quis sed qui qui. Optio mollitia animi esse. Soluta eum ut recusandae aspernatur exercitationem et. Sint voluptatum architecto est. Voluptas nihil ad nobis deserunt. Quia neque accusamus fugit repudiandae animi autem. Molestiae et qui deserunt. Non sapiente nobis autem eum totam. Dignissimos sit eum eius sunt. Consequuntur quia sit quia est quia. Dolorem beatae qui accusamus cumque quae. Adipisci dolores nesciunt. Rem id delectus et dolorem aut temporibus sapiente. Aperiam aut nihil recusandae quas. Assumenda ab voluptas esse dolor facere. Architecto sunt accusantium neque cumque rem optio dolore. Aliquid ut non commodi omnis minima. Sunt at voluptatem velit nostrum asperiores.",106,2018-06-26 10:11:49,2020-04-13 15:51:58,"EAR_NOSE_THROAT<>EYES<>HEART"
15,Facere ut voluptatum laboriosam.,"Voluptas officia cupiditate tempora omnis deleniti sed. Sint autem natus ad. Quam ut eligendi sunt ea suscipit nulla. Similique libero in omnis atque quisquam. Eos vero odit laudantium ea veniam voluptatibus molestias. Voluptate doloribus alias earum fugit ut ex dignissimos. Rerum nulla cupiditate error omnis odio. Minus consectetur dolor unde. Consequatur consequatur nam voluptates minima animi consequatur. Optio ut provident dignissimos molestiae aspernatur architecto. Nam reiciendis laudantium voluptatum et ea officia laboriosam. Ipsum nobis molestiae. Enim magnam voluptas dolorum aliquid enim alias. Possimus nemo molestias recusandae consequatur. Quae aspernatur qui saepe aliquam voluptatem. Quo enim sit. Ipsa non placeat rerum. Aperiam fuga omnis aspernatur. Et eum est et ut nobis reiciendis. Natus unde cupiditate illo rem.",172,2019-02-14 11:12:31,2020-04-13 15:51:58,"DENTAL<>SKIN<>HEART"
16,Quisquam minima voluptate tempora maxime velit.,"Voluptatibus dignissimos rerum nostrum inventore dolor vero. Excepturi sunt minus. Neque delectus sint consequatur alias voluptatem omnis. Et voluptatem voluptas sed. Enim cupiditate architecto ex. Maiores provident aut reiciendis aut est ut. Ut qui voluptatibus. Molestiae aut ut aut recusandae ut. Ea est et sint maiores tempora. Dolor sint ut minus. At qui aut. Amet odio voluptas ullam ducimus libero sunt inventore. Ducimus voluptas inventore ratione. Ipsum illum aliquid nulla molestiae adipisci iusto est. Quae earum blanditiis voluptatem et. Et voluptatem a eum atque dolore nemo deleniti. Nemo voluptate expedita ut mollitia sint facere. Voluptatem accusantium veritatis laborum rerum.",117,2020-03-01 14:28:18,2020-04-13 15:51:58,"EAR_NOSE_THROAT<>EYES<>DENTAL"
17,Ratione quia recusandae consectetur quis vero voluptas.,"Qui quia minus. Nihil aut nesciunt occaecati. Officiis esse neque atque eum. Non optio aut similique exercitationem. Deleniti laudantium iure. Omnis qui architecto voluptatibus commodi accusantium harum. Eveniet sunt laborum enim qui. Optio illum labore quia ipsum. Expedita aliquam quis expedita. Laudantium in impedit cupiditate. Officia quam et non aut at. Ducimus eligendi praesentium nulla et et aut reiciendis. Voluptatem explicabo dolor sit eius. Nobis quae ab harum officia et. Dolorum aut et neque exercitationem deleniti numquam et. Voluptatem quis numquam est quidem odit officia mollitia. Voluptatum laudantium et numquam. Quidem vel nam. Expedita in eum sunt illum natus voluptatem.",177,2018-05-08 16:07:01,2020-04-13 15:51:58,"EAR_NOSE_THROAT<>DENTAL<>HEART"
18,Id iste earum tempore.,"Quisquam aut perferendis. Iure doloribus beatae ipsam animi. Quae ut deleniti aut. A aut soluta delectus ratione distinctio. Explicabo qui quam et. Quod nihil ex totam. Architecto est dolore et doloremque nihil rerum. Ullam beatae similique. Aperiam vero laudantium. Saepe ut unde quos laborum. Perferendis atque tenetur dolores sit perspiciatis. Velit non quasi sint. Et quam velit molestiae ab. Minus numquam aspernatur ut natus nihil maiores ut. Expedita voluptatem ab repellat sed accusantium perspiciatis dolores. Cupiditate suscipit qui numquam quidem. Ad mollitia suscipit. Deserunt excepturi quasi nam sit debitis. Error aut possimus corrupti sint quo consequatur aut.",110,2018-05-21 02:46:36,2020-04-13 15:51:58,"EAR_NOSE_THROAT<>HEART"
19,Cumque voluptatem cumque.,"Dolorem aut neque cum incidunt architecto. Facere numquam odit. Deserunt non recusandae tempora occaecati non ullam. Provident sit accusantium quia itaque magni. Omnis consequatur vitae et vel occaecati. Ipsa repellat numquam amet. Quod explicabo et velit. Illum repellendus assumenda officia sed. Voluptatem et hic itaque repudiandae non ea perspiciatis. Rem quia non facere voluptas est. Tempora molestias et. Enim sint dolorum quasi. Tempore quia et veniam quia molestias. Et tempore id ut quibusdam pariatur. Accusamus accusamus sed nam est omnis non. Itaque blanditiis eaque ut non ipsam. Veniam ratione et esse quae doloribus quod. Et voluptas soluta consequatur. Totam illo non fuga dolor dolores quibusdam. Placeat a quasi veritatis repellendus omnis.",1,2019-08-08 03:10:46,2020-04-13 15:51:58,"DENTAL<>HEART"
20,Nulla sint minus.,"Hic dolor laudantium officiis tenetur eos. Repellendus eos expedita tempore sit et quia. Quas sit id saepe et. Veniam delectus omnis. Voluptate iusto et architecto ea quia quidem. Consequatur repellendus aperiam nemo in omnis. Assumenda rerum et quia qui ut incidunt. Corporis modi fuga maxime eum. Eaque aut illo quo. Non molestiae et illo nihil distinctio. Dolorem harum mollitia vitae. Earum expedita blanditiis unde. Voluptatibus mollitia sit. Quibusdam dolores qui ab error non odio. Sint cumque reprehenderit. Harum eveniet nostrum temporibus expedita et rerum voluptatem. Explicabo deserunt necessitatibus. Porro inventore ea omnis nihil impedit laborum. Molestiae voluptate quod temporibus libero. Optio nobis quam. Quis error magni asperiores.",71,2020-01-13 20:02:03,2020-04-13 15:51:58,"DENTAL"
21,Quae architecto qui in repellat perspiciatis optio excepturi.,"Sed saepe quasi voluptates aliquam est mollitia distinctio. Rem possimus vel quas et. Non autem dolorem impedit ullam dignissimos nihil eos. Fugiat dolores laboriosam eum quis et aspernatur velit. Sed placeat dolorem numquam. Fugiat quis est ullam praesentium rem ea. Quia quia iusto. Illum omnis quod iusto beatae qui molestiae. Officia quasi ad velit animi assumenda. Sit omnis expedita non ut voluptates. Magnam exercitationem asperiores animi voluptatem. Autem quam voluptas. Odio harum sint sed iusto. Possimus modi assumenda dolorum qui. Hic provident deserunt excepturi possimus ut veritatis sed. Consectetur earum porro ipsa et sed. Molestiae at laboriosam. Voluptatibus dicta minima pariatur. Sunt odit ut repellendus. Aut maxime accusantium quos aliquam beatae. Quibusdam magnam quia tenetur. Quae magni possimus saepe facere.",189,2020-03-21 09:14:44,2020-04-13 15:51:58,"EYES<>SKIN"
22,Nesciunt nihil totam quod ab ut.,"Sed vel repellendus aut. Aliquid consequatur veritatis modi. Provident recusandae explicabo. In sunt ratione nihil. Assumenda id suscipit quia et. Accusamus fugit et. Et sunt maxime quibusdam dolorem accusantium pariatur. Soluta nobis officia nam porro est eaque. Vitae voluptatibus officia. Labore iusto accusamus. Eaque rerum quis. Officia modi non. Eum eos cumque asperiores sit asperiores. Nihil a hic iste. Quibusdam nulla et. Consequatur aut ea quis et aspernatur aliquid modi. Ipsa delectus recusandae ut est. Eos omnis sint. Blanditiis corrupti unde vero rerum. Natus quidem officia inventore. Vel perferendis incidunt placeat dolores dolorem quas. Quas inventore consequatur cupiditate. Quo sint qui eum expedita non hic.",57,2020-04-10 00:32:05,2020-04-13 15:51:58,"CHEST"
23,Fugiat optio labore vitae earum.,"Doloribus dolores accusamus. Sunt dolor molestiae sequi dolore et quibusdam rerum. Quae qui nihil dolor minima. Aut voluptatem suscipit natus tempore perferendis nobis ut. Amet iusto sit eos ea. Nobis consequuntur ad omnis. Provident non earum sed magni reiciendis. Magnam quo ullam dolores. Sit voluptatem est aut. Sit quaerat saepe quaerat iure consequatur soluta. Blanditiis et dolores nesciunt eveniet quis. Sunt quos quis soluta necessitatibus autem. At unde eius non qui similique et consectetur. Occaecati et quae beatae ea culpa dolorem. Voluptatibus expedita explicabo ab quisquam at nisi ducimus. Doloribus vitae ut nisi officiis culpa molestiae. Dolorem beatae omnis recusandae est. Est error libero sit asperiores asperiores autem beatae. Quo error molestias. Voluptatibus vel et delectus cupiditate non ut. Est incidunt tempore consequuntur et qui.",157,2019-07-12 08:06:36,2020-04-13 15:51:58,"SKIN<>HEART"
24,Consectetur qui esse ipsum at quia quo.,"Inventore aut ut mollitia excepturi quo dicta. Sapiente molestiae eos molestias provident molestias. Facere dolorem perspiciatis quos quia corrupti. Id molestias voluptatum. Velit non enim saepe. Nihil quo quibusdam eius reprehenderit ea eos. Cum laudantium porro. Est nihil ea adipisci culpa aut. Molestiae eaque officia eligendi. Numquam rerum ut officia velit. Omnis sint ipsam corrupti libero. Ea eaque ex expedita. Expedita ullam dolores et temporibus. Qui debitis quidem repellat sint sint. Alias nihil quo id. Sapiente officiis aspernatur ducimus assumenda. Et ratione optio blanditiis omnis alias. Incidunt adipisci assumenda tempora excepturi optio eum. Officia distinctio dolor possimus quae sit exercitationem molestiae. Delectus consequuntur sint. Suscipit earum dignissimos. Assumenda et eum doloribus debitis sit non.",35,2019-07-18 11:09:43,2020-04-13 15:51:58,"EAR_NOSE_THROAT"
25,Voluptatem aliquam placeat.,"Repellendus et quis. Porro dolore vel qui repellat non deserunt. Quibusdam vel eaque. Repudiandae ab sunt rem impedit blanditiis voluptates. Voluptas et reprehenderit sapiente possimus qui id velit. Quaerat omnis fuga. Dignissimos ipsam accusantium. Nemo natus eius et. Iure excepturi sit voluptate quae laborum. Sapiente tempore ducimus velit qui laborum tenetur nihil. Ut voluptas exercitationem dolor. Distinctio ullam aspernatur a non. Enim nostrum voluptatem sed non sapiente quisquam. Quas quasi molestias explicabo iusto commodi repellat ab. Aut aut porro quia enim reiciendis eos. Et doloremque libero alias ex iure. Odit repellat distinctio in quaerat voluptatem. Et repellat consequatur cumque libero dolore nam. Sint molestiae officia aut qui laboriosam aspernatur. Totam suscipit minus distinctio eaque ut. Eveniet aut ut occaecati ea voluptatibus.",117,2020-03-11 10:45:41,2020-04-13 15:51:58,"HEART"
26,Qui sed facere aut.,"Qui omnis a sunt ullam. Omnis vel labore necessitatibus quis qui. Et consequuntur sit. Saepe natus dolor beatae voluptas non at corrupti. Non voluptates explicabo quam pariatur quos dolores. Sit natus ipsa unde quo corrupti et. Ipsam ex cupiditate placeat non reprehenderit explicabo doloribus. Id aliquam ipsum non quibusdam. Labore et velit. Porro voluptas quaerat non temporibus voluptatem atque nam. Et quia eos amet veritatis. Magnam maiores sed in dolorem ut. Eum nesciunt velit. Quas cum a consequatur non nostrum. Ut eos quo. Mollitia atque reprehenderit. Consequuntur inventore adipisci facilis. Dolorum in voluptatibus temporibus accusantium nihil porro neque. Beatae et ea numquam. Deserunt id tenetur perferendis autem fugiat qui quisquam.",157,2020-04-03 08:02:34,2020-04-13 15:51:58,"EAR_NOSE_THROAT<>CHEST<>SKIN<>HEART"
27,Dolores voluptatum cumque.,"Eos nam dolores voluptatum dolor expedita praesentium. Quis consequatur illo. Officia laudantium voluptatum. Sunt voluptatem soluta sint beatae hic ducimus quis. Voluptates quasi quibusdam quaerat rerum. Enim optio corporis voluptatem maiores ipsam error. Rerum optio ut laborum velit pariatur cumque et. Nobis quae expedita. Vel sed dolor eum officiis aut illo earum. Cupiditate rerum ducimus accusantium rerum eos ut quaerat. Repellendus eum dolores voluptate sit ab. Praesentium pariatur ut accusantium in aut. Quis qui iste voluptatem ea aliquam deleniti explicabo. Nisi autem suscipit repudiandae necessitatibus sint. Explicabo ut voluptates omnis aliquid. Dicta maiores nesciunt molestiae saepe in ut officiis. Sint nam in eos eius perspiciatis sunt. Omnis voluptates eius. Laudantium veniam necessitatibus odio ut reprehenderit est. Fugiat eum ut ut.",118,2018-01-21 16:06:20,2020-04-13 15:51:58,"EAR_NOSE_THROAT"
28,Pariatur ex et nostrum.,"Corporis debitis natus eum enim amet repudiandae. Sunt laboriosam a excepturi sapiente. Eligendi sequi quia. Aut non consectetur voluptatem reprehenderit. Magnam odit aut autem delectus voluptatem quibusdam. Sunt laborum quia deserunt ipsum enim. Suscipit optio explicabo vel harum voluptas. Sint sapiente architecto necessitatibus accusantium ab sequi modi. Animi beatae eos ut et aut aliquid. Consequatur commodi minima. Qui totam labore id laboriosam consequuntur. Maxime repellendus quaerat architecto rerum quia. Saepe perspiciatis ex sapiente odit iure. Consequuntur voluptas quia officia consectetur earum sint. Officia iure cum nihil. Beatae est et. Iusto at rerum non ut. Reprehenderit dolorem natus at ipsum voluptatem accusantium. Repudiandae nesciunt eveniet delectus itaque quis. Eaque voluptates rerum magnam aut a. Officia amet aut in praesentium sunt repellat.",57,2019-11-21 05:53:58,2020-04-13 15:51:58,"EYES<>CHEST<>DENTAL"
29,Voluptatem laudantium consequatur tempore.,"Aliquid incidunt perspiciatis culpa. Doloremque sunt quos et dolorem et. Rerum ex corporis earum nisi et. Doloribus expedita id sunt enim. In rerum voluptas blanditiis veniam nisi. Ut natus ex non omnis animi. Maxime a quo exercitationem. Nulla nobis enim id debitis ut voluptatem. Voluptas quisquam nemo. Distinctio quis explicabo sunt debitis at culpa ipsam. Ut qui consequatur nihil earum ratione et. Magnam quia ut pariatur est quis excepturi. Aliquam assumenda reprehenderit fuga non. Ea et tempore labore. Ullam tenetur dolores. Numquam aspernatur eum repellendus. Alias voluptas aut beatae qui aspernatur alias dignissimos. Veritatis corporis ea odio aut voluptatem et. Amet sunt cumque et laudantium. Velit nesciunt aliquam et sunt odit.",3,2019-10-04 21:56:47,2020-04-13 15:51:58,"EAR_NOSE_THROAT"
