30,Similique illo fugit dolor occaecati non dolores.,"Molestiae neque nobis dignissimos tempora atque doloremque omnis. Illo molestiae iste expedita eos vel. Nobis est adipisci voluptas non quia consequuntur facilis. Fugiat ipsum aut dicta nobis et. Aperiam sint voluptates sunt maiores consequatur. Blanditiis pariatur quos nostrum. Aliquid labore deserunt. Necessitatibus aperiam magnam quia at ut quos. Iusto eius nam sequi cum aut. Accusantium iste debitis reiciendis id ut quibusdam voluptatum. Hic temporibus dolorum debitis aut ad omnis cumque. Sed dolores sequi sed occaecati eligendi fuga. Incidunt dolore ratione occaecati magnam. Id qui consequatur vel deserunt. Qui consequuntur et ut consequatur voluptas. Maiores eos asperiores sunt aliquid eligendi aut. Occaecati magni omnis voluptas. Veniam quod quia est ex exercitationem. Accusantium distinctio autem non et.",3,2019-11-30 06:06:05,2020-04-13 15:51:58,"EYES<>SKIN"
31,Qui dolores consectetur omnis corrupti sapiente.,"Veritatis non voluptatem doloribus dolor aut. Natus debitis corrupti qui est. Eveniet repellat accusamus quia tenetur quam consequuntur doloribus. Minus nam nulla ipsum aspernatur. Repellendus magni ipsam nisi. Aliquam eum et totam sunt. Inventore fugit architecto. Velit id officiis et ad. Inventore repudiandae voluptatem dolor ducimus omnis rerum fugiat. Laborum iste velit deserunt qui. Eum ut ut. Possimus perspiciatis qui. Non nam accusantium voluptatem ipsa exercitationem nam dicta. Saepe dicta commodi consequatur. Neque est sit facere est eaque perspiciatis. Molestias totam omnis aliquid. Necessitatibus deserunt cumque non. Sit voluptate deserunt harum eos tempora voluptatibus. Sed ipsa numquam dolorem iste necessitatibus repudiandae perspiciatis. Saepe quaerat maxime quaerat. Quis dolorem voluptates. Doloribus rerum corrupti et quod.",172,2019-10-14 01:36:26,2020-04-13 15:51:58,"CHEST<>DENTAL"
32,Doloribus ut unde.,"Voluptatibus neque qui voluptatum dicta consequatur soluta. Sint veritatis eos est id et. Necessitatibus ipsam sequi dicta voluptatum eius. Harum praesentium eum. Molestiae optio consequatur dolores occaecati sapiente aut. Eligendi adipisci rerum sint totam. Consectetur earum nemo dolor rerum. Et debitis quaerat. Non non eum. Magnam consequuntur dolor. Blanditiis ad facere qui quasi consequatur. Temporibus nihil similique laudantium. Iste a et recusandae debitis tempore. Officiis aliquid omnis qui. Et maiores dolore nemo sit nemo occaecati velit. Et tempora error quasi molestiae. Commodi dolorem odit est nulla deleniti. Qui omnis sunt earum ut facere. Quia quo ab nostrum et sint.",117,2019-10-01 14:36:48,2020-04-13 15:51:58,"EYES"
33,Incidunt cum non.,"Quo alias et aut velit voluptatum ullam. Occaecati vel pariatur ut quia. Nemo necessitatibus veniam et rem est. In animi rerum nam fuga natus corporis consequatur. Vero quibusdam nostrum sed et. Esse ex incidunt ut voluptate eius eos. Nisi quia cum. Voluptatem aliquam unde maxime voluptatem autem ut. Ipsa eligendi libero. Quos aut velit natus autem maiores. Veniam ut accusantium autem. Reprehenderit aperiam ut reiciendis. Dolores totam aut est dolor explicabo dignissimos enim. Non ut optio reiciendis debitis. Iste numquam inventore blanditiis. Cupiditate minus quam voluptatem vero. Assumenda molestiae sit dignissimos. Aut est error voluptatem quisquam perferendis.",123,2019-09-29 09:10:31,2020-04-13 15:51:58,"EAR_NOSE_THROAT<>CHEST"
34,Ipsam illum est porro consectetur.,"Ab itaque omnis. Quod excepturi placeat. Ullam pariatur vero a atque. Et facilis qui occaecati recusandae asperiores. Voluptatem voluptatem quia aperiam magni. Ad praesentium dolorem quasi ad placeat. Aut esse ut sed dolore. Quidem nemo itaque sapiente rerum. Omnis dolores non veniam dignissimos corrupti iste. Deserunt debitis in. Quisquam iure dolor aperiam. Accusamus et velit facere est dolorum. Sed fuga qui et ipsam excepturi. Et consequuntur saepe totam. Quia quidem est sunt facilis. Qui assumenda ab consectetur incidunt deleniti eaque. Nihil nobis cum nesciunt esse ut. Doloribus iure optio delectus eos labore placeat aut. Et neque praesentium. Qui itaque qui culpa officiis dolorem tempora.",127,2016-09-20 06:26:08,2020-04-13 15:51:58,"EYES"
35,Quidem id cumque debitis quibusdam.,"Cum et vel error alias dolor voluptatem. Beatae iste rerum. Dolorem eos sunt. Ex est qui sunt eligendi quia totam nihil. Omnis aut et delectus nostrum. Inventore accusantium blanditiis et et voluptatibus est. Qui aut explicabo mollitia. Voluptatem enim animi qui. Impedit amet quibusdam. Accusantium quidem et facilis temporibus minus iusto. Iusto quam dolores. Tempore veritatis atque illum magni et. Et amet dolor accusantium. Sunt incidunt in excepturi recusandae enim. Natus deleniti praesentium tempore exercitationem. Vitae est sit qui. Ut minus veritatis quas consequatur. Dicta incidunt aut aspernatur consectetur ducimus voluptates. Omnis eaque ut rerum. Officiis fugit consequatur perspiciatis voluptas. Rerum ut et dolor eum omnis ut. Est error at facere necessitatibus numquam sed.",30,2019-12-27 22:50:38,2020-04-13 15:51:58,"DENTAL<>HEART"
36,Quis sed natus dicta id.,"Ipsa incidunt consequatur ut natus. Eum voluptatem iusto eos qui. Qui quidem numquam et aut voluptates corrupti sunt. Minus at tenetur quidem doloribus sint animi est. Sit repudiandae quia dolores officia officia vero maxime. Eos libero impedit et. Id neque iste error labore est qui. Rem maiores in. Placeat est dolorum amet porro aut. Assumenda autem quam distinctio eos consequuntur. Accusamus magnam illo deserunt sint aliquid. Rerum facere magnam temporibus veniam est porro eius. Voluptas totam iusto esse. Molestias dolor iure quas. Aut labore ea delectus est earum ut perspiciatis. Autem ad autem ut. Qui recusandae voluptas quos eum nisi eum. Necessitatibus non quia tempore molestias architecto aliquid. Eum velit quod. Et minus et inventore aspernatur dolores placeat. Officiis qui ducimus voluptas ullam est voluptatem nobis. Architecto odio ut rem facilis dolores odio minus. Ipsum laboriosam eveniet et.",164,2019-11-07 14:24:36,2020-04-13 15:51:58,"HEART"
37,Iure id excepturi sed.,"Ipsam alias vero nihil accusamus. Modi voluptatem quia velit sit ratione perspiciatis illum. Voluptatem facere et maiores nemo. Animi consequuntur earum dignissimos similique iusto qui. Et earum repellat veritatis maiores. Ratione sed veniam ut aperiam. Quia sed qui est animi consequatur ratione nemo. Maiores nesciunt harum cupiditate qui amet. Dolorem sed asperiores qui perspiciatis soluta minus. Quam delectus voluptatum. Laboriosam ut provident vel. Et soluta dicta qui veritatis tempora odit est. Atque et eveniet voluptatibus neque laboriosam consequatur. Quas asperiores qui. Corrupti sed neque. Tenetur repudiandae vero ipsa. Iusto accusantium dicta explicabo dolorem inventore ea rerum. Commodi ullam reiciendis maiores et officia amet. Et rerum ea odit vel tempora inventore dolor.",117,2020-03-14 01:33:02,2020-04-13 15:51:58,"EAR_NOSE_THROAT<>CHEST<>DENTAL"
38,Qui voluptatibus minima porro consectetur.,"Eaque nostrum voluptatem expedita consequatur. Enim est dolores nisi doloribus vero. Voluptates reprehenderit ullam ut qui adipisci a quos. Velit autem nihil consequatur occaecati distinctio expedita minima. Aperiam reiciendis sed dolores incidunt id vel pariatur. Vero velit optio a in. Maiores dolor eaque est. Commodi laboriosam qui iste earum laudantium eius. Qui mollitia qui facere. Dolores ipsum qui distinctio aliquam. Aut est eveniet voluptatem quas odio et placeat. Suscipit eum reiciendis. Facere magni dolor et exercitationem dolor officiis. Error nihil quia dolor veniam deleniti voluptates sunt. Facere adipisci voluptatem consectetur rerum iusto. Quo laborum voluptatem exercitationem perspiciatis earum cumque. Excepturi vero rerum laboriosam rerum. Dignissimos eum quia nihil tenetur accusantium fugit natus. Et modi cumque provident alias et.",103,2018-10-22 23:13:07,2020-04-13 15:51:58,"CHEST<>HEART"
39,Ut voluptas et quis qui et.,"Nihil quisquam libero quae fugiat est blanditiis unde. Nobis architecto ut officiis doloremque sint voluptas repellendus. Doloremque qui quibusdam aut ut commodi natus quos. Possimus voluptas eos. Praesentium facilis quis excepturi sit nam animi. Quos aut voluptatem. Eligendi laboriosam possimus ad quos adipisci eius officia. Qui sit voluptatem nostrum excepturi. Dolor enim sunt maxime voluptatem assumenda. Cupiditate quae quos. Et rerum vel expedita cupiditate eaque. Optio vel non et eum aut cumque. Incidunt similique saepe voluptatem ut blanditiis quam voluptas. Cum libero aut vero alias quo veniam. Illo aliquam voluptas qui eius porro repellat magni. Quisquam quam quo quas. Qui voluptatem aperiam. Ut minima consequatur vero saepe nesciunt sunt. Ab repudiandae dolorem consequuntur quia placeat.",127,2018-10-04 12:55:34,2020-04-13 15:51:58,"DENTAL<>SKIN<>HEART"
40,Sed mollitia voluptatem sunt.,"Quod sint doloribus cumque omnis quia quibusdam. Illum dolorem qui incidunt sunt dignissimos vel. Aut nulla quia ipsam sit voluptatum voluptatem consectetur. Consectetur asperiores quia eligendi magnam iure eveniet. Nihil sit sunt possimus odio totam nemo cum. Quae quia culpa. Laborum et delectus ut officiis. Amet voluptas ipsa ipsam. Officia voluptatem numquam aspernatur recusandae. Omnis consequuntur accusantium aspernatur. Vero ab eos laudantium. Cum sapiente et veniam. Possimus et in vitae occaecati quibusdam qui dolores. Quia ipsam laborum beatae quisquam unde tempore. Dolores voluptatibus dicta et earum sit fuga odit. Est exercitationem ratione corrupti et quo reprehenderit quasi. Natus ut possimus ut quasi odit quos. Aut aut magnam doloremque. Et cumque incidunt voluptas placeat at. Dolorum blanditiis accusamus nostrum et.",180,2019-12-28 09:05:46,2020-04-13 15:51:58,"EAR_NOSE_THROAT<>EYES<>DENTAL"
41,Necessitatibus odit exercitationem quo eum repellendus non blanditiis.,"Et eum quis reprehenderit ut. Aliquid molestiae molestiae corrupti. Facere quidem non fugiat minus rerum. Quis corrupti architecto alias sit vel. Mollitia commodi rerum modi ipsam nisi suscipit corrupti. Totam qui asperiores et. Soluta sunt laboriosam cumque sit voluptatum molestiae est. Dicta magnam qui quas cupiditate voluptatum tempora. Asperiores et omnis expedita est et. Eum odit adipisci temporibus ut recusandae quidem. Atque et delectus et labore illum occaecati. Quia qui qui ea voluptatibus consequatur. Voluptas aut et ex dolorum laborum suscipit iure. Ut dicta magnam et maxime est ut. Nesciunt delectus pariatur excepturi laboriosam veritatis eos. Neque omnis quisquam aut quis dolore. Velit perferendis ipsum ad sapiente minus.",180,2019-03-20 01:03:34,2020-04-13 15:51:58,"SKIN"
42,Qui dolore consectetur consectetur neque.,"Cupiditate ut qui sed corporis. Sed et in placeat dolorem. Non repudiandae cum. Quia nam repellat dolor cumque. Qui qui sunt dolore et deleniti sequi. Autem eos doloremque voluptates corrupti in et. Aut beatae a saepe ea alias. Eum provident inventore quia perferendis. Et necessitatibus omnis aut quia dolorum inventore. Aut et et. Quidem minus sapiente molestias commodi eos. Maiores ea nesciunt quibusdam est ut esse. Et suscipit porro laboriosam enim sunt doloribus. Molestias inventore excepturi aut consequuntur sit ratione magni. Quia tempore ea. Omnis magni et officia deleniti. Minus et in ratione ut est. Dolor error consequuntur consectetur quia dolorem sed tempora. Laudantium modi nemo ipsum quod non cumque. Autem in porro molestiae enim. Omnis provident eveniet omnis blanditiis rem.",57,2020-02-18 06:13:46,2020-04-13 15:51:58,"EYES<>DENTAL<>SKIN"
43,Dignissimos soluta qui id ipsum similique inventore.,"Nesciunt reiciendis illo et voluptatum. Eum quae autem ut beatae ad alias rerum. Hic placeat aut ipsa aut dolorum minus iste. Praesentium minima voluptas veritatis dolorum voluptatem repellendus. Labore sit enim error quos. Eveniet architecto fugit molestiae omnis. Laboriosam animi at quos aspernatur aperiam iste minus. Facere qui et eum. Ea error ut suscipit. Ut quod sunt ut nulla reprehenderit omnis reiciendis. Provident corporis totam autem quisquam sed ea. Aut rerum repellendus qui magni et. Voluptates voluptas ipsa provident nihil quam repellat dolores. Qui incidunt rem quia dolorum fugiat inventore. Est eligendi ipsum et. Expedita officiis quo sunt consequuntur minima. Est sunt quia fugiat. Qui iure optio dolores. Assumenda aut aut blanditiis nostrum enim. Ducimus illo nemo asperiores. Quibusdam quos voluptas eos maiores amet.",118,2017-04-21 21:10:13,2020-04-13 15:51:58,"EAR_NOSE_THROAT<>CHEST"
44,Ea harum voluptas culpa labore nobis dolores.,"Quam ipsum aperiam. In ut id animi natus aliquid provident molestiae. Et quia autem nisi dolores quia. Harum voluptate placeat consequatur qui fugiat. Sint quia quos ratione cupiditate incidunt id. Repudiandae aut voluptatem quae repellat totam. Eius tempora velit eos. Suscipit reprehenderit incidunt magnam eum ipsa culpa. Culpa in est animi et quo voluptas. Eos sed aliquam. Et voluptatum minus cumque reiciendis veritatis. Sapiente libero corporis similique eius fugiat porro deserunt. Ex labore dolor. Fuga unde optio omnis et. Iure quia qui necessitatibus animi ipsam ad. Dolores similique sunt est rerum. Porro molestiae adipisci quod voluptatem iste molestias aspernatur. Ratione vel itaque. Necessitatibus consequatur fugit facere dolores dolores inventore. Rerum a et ut ducimus.",49,2018-06-01 03:07:08,2020-04-13 15:51:58,"HEART"
45,Quod fugiat assumenda.,"Officiis qui animi aspernatur qui voluptas. Et velit est modi veritatis autem. Dolorum laudantium rerum eum. Qui veritatis et quas. Et nesciunt et. Hic non rerum alias commodi officiis impedit. Facere libero reiciendis aut nesciunt sequi facere necessitatibus. Numquam qui ratione quo doloremque quibusdam molestias. Reiciendis nemo ullam. Quo atque non et. Eaque magnam voluptatem veniam optio reiciendis officiis rerum. Cumque amet velit et qui unde alias. Est magnam exercitationem delectus illo autem sint. Est minus quo temporibus. Explicabo voluptas sit rerum. Necessitatibus ea perferendis consequatur. Numquam vitae non sed nulla ullam tenetur quia. Assumenda ut qui. Ducimus vel est aliquam amet. Enim rerum pariatur quas rerum vel. Nobis laudantium nam occaecati nam culpa a laborum.",196,2019-11-09 01:26:09,2020-04-13 15:51:58,"HEART"
46,Aliquid aut quisquam in qui et neque sapiente.,"Aut nam at distinctio neque provident. Omnis velit nemo ex fugit distinctio ipsum. Harum natus nobis similique sequi vel. Et tempora aut. Qui voluptatem rerum. Harum est aut suscipit minus rem. Eaque quisquam dignissimos quia sed. Ut dolor temporibus. Ut esse doloremque non doloribus perspiciatis. Vel ex culpa culpa nisi. Accusantium est ipsum eligendi. Ipsa ipsam quia qui maxime neque asperiores voluptate. Esse similique unde maiores neque ipsam fuga eos. Et quidem consequatur voluptatem voluptas ut. Qui magnam at. Blanditiis nihil labore perspiciatis beatae. Qui excepturi reprehenderit temporibus amet dolores placeat qui. Et enim itaque soluta nihil. Quae voluptatem explicabo. Nam perspiciatis omnis alias porro. Eligendi sed excepturi et.",12,2018-02-17 00:59:32,2020-04-13 15:51:58,"DENTAL"
47,Ut ex temporibus non totam dolor.,"Animi totam nam dicta. Ut totam est ratione laboriosam tempore laborum sint. Omnis porro explicabo aut impedit iusto. Totam adipisci porro. Aut tempora rerum voluptatum autem. Soluta fugit earum possimus labore nihil. Est sed modi ut vel aut sed distinctio. Autem odio molestiae hic id aut quaerat tenetur. Iste vel repellendus. Ab animi laboriosam suscipit. Sint laborum vero eveniet dolorem aut perferendis neque. Repudiandae ut sed totam consequatur voluptatibus tenetur doloribus. Quasi et voluptas aliquid enim quod enim adipisci. Eos quae nisi dolor hic. Ratione ducimus sed ad id modi doloremque accusantium. Necessitatibus aut reprehenderit at harum ut. Id consequatur eum. Corrupti et omnis saepe minus. Illo minus et velit.",117,2020-02-16 02:30:16,2020-04-13 15:51:58,"DENTAL"
48,Nam quasi molestiae dolorem est aut sequi facilis.,"Delectus architecto qui dicta tenetur blanditiis. Facere dolorem corrupti voluptas nostrum. Et earum non ut veniam blanditiis saepe odit. Iste quisquam autem sed. Tenetur voluptatem nostrum assumenda quia. Aut et corporis eum eos cum. Illo voluptas cum sit harum voluptas. Voluptatum dolores tenetur unde in blanditiis non. Dicta voluptatem quia ipsam. Aliquam vel vel et aut est incidunt. Officiis assumenda debitis omnis odio neque ut. Et nesciunt consequatur fugiat iste provident iusto. Omnis distinctio qui velit non non consectetur nisi. Voluptatum libero hic quaerat vel rerum. Aliquam aspernatur provident nobis occaecati. Iste aut tempora modi. Dolorem dolor ducimus nemo reiciendis quidem. Ipsum qui libero excepturi rem dignissimos dignissimos qui. Sed velit temporibus quos cumque laudantium maxime dolor. Eum harum aliquid. Omnis voluptas et iste cum architecto.",31,2019-01-28 08:34:50,2020-04-13 15:51:58,"CHEST<>SKIN<>HEART"
49,Ratione id dolor ut quas.,"Nostrum nulla ab excepturi consequatur. Distinctio velit consequatur voluptatibus qui asperiores. Non nemo reprehenderit nihil molestias placeat suscipit. Error necessitatibus voluptatem. Incidunt temporibus molestias quas labore aut adipisci. Dolor culpa rem a eius quia magnam. Odit velit facere saepe. Sunt odit cumque alias voluptas nesciunt est. Est corporis eius dolore qui qui voluptatibus. Rerum mollitia ipsa in. Mollitia et aut eveniet ullam quae facilis. Officiis et voluptatem voluptatem quia eos veniam sapiente. Pariatur suscipit facilis dolorum consequatur aspernatur quis deleniti. Sed molestiae et id. Necessitatibus vero laudantium hic corporis ut non. Minima voluptatem aperiam quo voluptatem. Nobis repellat et voluptatibus. Esse non consequuntur odio et laborum ducimus. Minima qui cum. Sequi dolorem quia et placeat aut est.",67,2020-01-10 19:56:27,2020-04-13 15:51:58,"HEART"
50,Deserunt beatae aut laudantium.,"Voluptas tenetur accusantium enim dolorum. In eum eum ut autem nihil assumenda adipisci. Exercitationem debitis quaerat veritatis. Amet assumenda similique nobis possimus. Omnis minus sit voluptas. Veritatis delectus architecto non vitae in corrupti. Sequi enim aut ut. Optio incidunt incidunt dolorem ut qui et sunt. Rerum animi vitae quisquam optio enim ad dolor. Ipsum voluptatum vero nesciunt iste dolores magni. Beatae consequuntur quo consequatur qui eum itaque. Maxime enim voluptas voluptas dicta eos enim. Omnis aut ipsum dolorem qui. Corrupti et laudantium. Aut laudantium cupiditate excepturi alias voluptas aut. Quos voluptatem optio ab totam quis iste. Sit expedita nemo. Earum rerum nisi impedit et incidunt repellendus et. Qui excepturi libero ex unde omnis dolores sapiente. Reprehenderit labore quasi.",159,2019-06-07 18:14:40,2020-04-13 15:51:58,"CHEST<>DENTAL<>SKIN"
51,Voluptas nihil minima dolor quae.,"Sit et suscipit. Sed nisi ut qui nihil ea qui nihil. Ut magni in soluta. Nihil occaecati rerum. Qui et molestiae laudantium. Sint quo sit aut reiciendis quis illo. Iure vel earum repellendus id. Eos est saepe id eligendi. Quis et cumque reiciendis. Dolor qui voluptas neque cumque. Tempore nulla atque deleniti sint. Omnis cum ut facilis sit qui non a. Consequatur praesentium minima facilis voluptatum rerum. Corrupti ipsam inventore quia natus. Dolor excepturi perferendis et iste libero aspernatur qui. Nesciunt sapiente ullam eum unde repellat vel. Aut impedit ipsum deleniti sed ipsa accusantium suscipit. Voluptatem voluptatem libero.",164,2019-09-04 02:38:53,2020-04-13 15:51:58,"EYES"
52,Temporibus eaque expedita natus fugiat sit.,"Corporis aperiam et enim mollitia excepturi perferendis. Suscipit ducimus labore accusantium. Dolores fuga rerum repudiandae incidunt quam enim maiores. Cum repudiandae omnis. Minus neque quas totam minus omnis ut. Sit aut hic. Voluptas et quo nostrum qui tempore omnis pariatur. Cumque eaque expedita fuga eos. Perspiciatis sit quidem quas qui at. Sunt quaerat atque voluptates dolore non animi. Quia ex mollitia corrupti perferendis. Quia veniam repudiandae. Debitis aut quisquam dolorem maxime nihil. Voluptas enim eveniet. Veniam tenetur voluptates fugiat quia magni est sed. Laudantium reiciendis voluptatem. Placeat fuga est. Modi suscipit ea quidem. Nisi et consequatur rem et rerum. Natus eos eos quia consequuntur officia molestiae molestias. Dolorum nostrum nihil vel laborum minima. Doloremque qui animi earum.",111,2020-03-03 12:24:43,2020-04-13 15:51:58,"SKIN"
53,Iusto eos in dicta.,"Vitae maiores culpa a ad voluptatem. Aliquid aut repellendus. Corporis praesentium consequatur maxime dicta ipsam. A natus corporis. Aspernatur dicta incidunt qui ullam perferendis. Voluptas dignissimos provident quaerat. Earum vero qui facere ut. Deleniti eligendi explicabo vel. Iusto voluptatum ratione. Doloribus est alias recusandae dolore fugit sit eum. Consequatur nulla culpa est possimus cum quis itaque. Laudantium suscipit officia animi enim. Ad recusandae fuga. Soluta dolor quasi amet. Saepe cumque est vero incidunt ipsa eum. Omnis sint consectetur eum qui. Odio dolorem quasi provident sint. Fugit nam odio quas quaerat optio eos hic. Laudantium eveniet minus velit ut ut perferendis. Blanditiis dolorem quia occaecati aut atque sed. Molestias ullam maxime nulla magni earum enim.",74,2019-06-18 12:07:48,2020-04-13 15:51:58,"SKIN"
54,Qui hic voluptatem maiores in.,"Enim neque dolor optio. Aut voluptate quis repudiandae ut. Dolor ratione sequi et. Eaque natus unde nisi ea. Distinctio autem esse voluptatem delectus tempora. Reprehenderit aut odit. Sed ipsam rerum. Nobis velit laboriosam modi. Aut ut laborum. Voluptate modi nobis voluptas atque quod. In eaque possimus suscipit. Laborum necessitatibus porro magnam. Laudantium sit eum placeat vel aut. Est facere quibusdam dolor incidunt. Excepturi ducimus aliquid ea sint est perspiciatis ad. Ea accusantium sed consequuntur. Sapiente totam earum sunt nam voluptas dolor dolor. Quia laudantium placeat et quas. Voluptatibus et vitae voluptatem. Earum vel sit dolor ut. Omnis atque voluptatem.",159,2019-02-25 15:15:17,2020-04-13 15:51:58,"EYES<>CHEST<>DENTAL<>SKIN"
55,Dolor laudantium sapiente nobis fugiat est architecto.,"Excepturi excepturi quas earum non corporis. Ab autem voluptatem ut velit corporis. Ut rerum est harum ducimus aut. Fugiat nam asperiores. Minima id dolores dolore ab odit a aperiam. Rerum molestias sunt quidem et. Nobis eveniet nihil nostrum alias. Quas ut et cupiditate ducimus libero deleniti. Ad alias voluptatibus. Veritatis molestiae ut laboriosam ut voluptates nesciunt. Et laborum et sit velit qui accusamus. Et aspernatur repellat voluptas porro perspiciatis harum voluptatem. Aut ipsa vel in voluptatibus explicabo. Pariatur occaecati harum. Sed hic qui occaecati alias fugiat expedita. Ducimus quo voluptatum voluptas qui quidem. Molestiae qui maxime optio et sint dolorum. Et cupiditate minus vel qui sequi animi sint.",184,2016-05-20 01:35:57,2020-04-13 15:51:58,"CHEST"
56,Et cum quisquam sed.,"Omnis beatae consequatur. Est sit voluptatem harum. Quidem minus blanditiis. Est velit nulla et voluptatem incidunt qui quas. Magnam molestiae excepturi aut adipisci quam asperiores. Id placeat molestias dolores ut pariatur consectetur aut. Totam facilis sit. Voluptatem rem quia repellat quas magni quasi. Hic nihil nulla facere facere aut. Veniam fugiat et delectus unde nobis. Qui dolorem vel illum tempora. Eos totam molestiae animi et dignissimos perspiciatis ad. Voluptatem voluptatem distinctio voluptatem autem quo necessitatibus et. Necessitatibus ut consequatur aut deserunt. Labore et rerum dolores quia sapiente. Modi consectetur totam sunt. Quae dolor quod.",160,2019-05-21 10:15:17,2020-04-13 15:51:58,"EAR_NOSE_THROAT<>EYES<>SKIN"
57,Excepturi laboriosam aut vel non facilis quaerat.,"Veniam quibusdam voluptas qui. Aut reiciendis omnis est facilis consequatur reiciendis. Voluptatem aliquid aut et id dolore magnam. Facere tempora at. Aut fugit delectus dolore saepe doloremque minima. Voluptas laborum ut error. Possimus ipsum neque quisquam corrupti veritatis. Est aliquam nisi et tenetur ad et beatae. Illo accusamus quia tempora autem. Dicta dolores perspiciatis quis illum voluptas. Nostrum qui repellat aperiam expedita nemo voluptas quis. Deleniti rem est sed nihil totam quo. Eaque qui et rem similique corporis. Dolorum fuga vero quia dicta consequatur. Non illo reprehenderit. Numquam ipsam distinctio accusantium ea repellat voluptate voluptatem. Quis illo quam accusamus porro ut optio. Quo qui id. Culpa omnis animi quam. Velit dicta dolorum.",57,2020-01-02 23:02:26,2020-04-13 15:51:58,"EYES<>CHEST<>SKIN"
58,Maxime rerum rerum a voluptas reiciendis.,"Est cupiditate aut non. Esse aliquid omnis. Et quia dolore et voluptas. Sit qui repellat consequatur accusamus eos. Qui rerum esse aperiam unde iure a. Totam aut molestias id saepe at dicta qui. Quasi doloribus soluta unde molestias voluptas voluptatem necessitatibus. Autem et tempore eaque est illum. Sit quos rerum quibusdam est saepe minima enim. Quo unde saepe velit sint. Nihil blanditiis quis quia ad sit odit tempore. Et id rerum nisi cupiditate odio et quos. Voluptate suscipit velit corrupti consequatur. Et consequatur sapiente laboriosam vero nulla mollitia quam. Ullam voluptatibus id voluptas vel eaque. Ut dolorem adipisci sunt ipsam. Dolor quia et est. Vel soluta modi. Quasi voluptatibus ea numquam consequatur velit vero quia.",140,2019-07-09 00:32:47,2020-04-13 15:51:58,"EAR_NOSE_THROAT<>DENTAL"
